{
  "boundary": {
    "entry": "cairo.witness.pedersen_builtin.logical-inputs",
    "exit": "cairo.witness.pedersen_builtin.base-trace-and-facts",
    "operation": "cairo.witness.pedersen_builtin"
  },
  "fixture_class": "tiny",
  "fixture_id": "tiny.witness_pedersen_builtin.v1",
  "full_proof_semantic_hash": null,
  "oracle": {
    "candidate_independent": true,
    "implementation": "gpu-lab/tools/lab.py:pedersen_oracle",
    "provenance": "reviewed candidate-free PedersenBuiltin slab descriptor",
    "reference_closure_sha256": "1779ff6a1e1aee684475e3c1c30a6e5f9c483d325c588ee7fe1d8e513bf5f2a0",
    "reference_sources": [
      {
        "path": "stwo-cairo/gpu_benchmarks/lab/fixture-export/semantics/pedersen_builtin.slab-semantics.v1.json",
        "role": "semantic_descriptor",
        "sha256": "a09c8906415dfcda8cc62111aa0acbd21b0096ca4bb2e744caada73d133db9ea"
      },
      {
        "path": "stwo-cairo/gpu_benchmarks/lab/fixture-export/src/pedersen_builtin_semantics.rs",
        "role": "golden_evaluator",
        "sha256": "6523ad84c9d743203946141c48ffe8593ec0c2eb62b03482fb2c7182eec5c00d"
      },
      {
        "path": "stwo-cairo/gpu_benchmarks/lab/fixture-export/src/semantic_support.rs",
        "role": "golden_support",
        "sha256": "5caf897b1ffd724b073c4a3646dfb1d554b33c99345b17bbdbabd6dd766431f2"
      }
    ],
    "version": "candidate-free-scalar-v2"
  },
  "proof_identity": {
    "full_proof": false,
    "id": "tiny.witness_pedersen_builtin.v1",
    "kind": "synthetic_kernel_slice"
  },
  "schema_version": "stwo.gpu-lab.semantic-fixture.v1",
  "semantic_identity": {
    "kind": "kernel_slice",
    "schema": "stwo.gpu-lab.slab-semantics.v1",
    "scope": "cairo.witness.pedersen_builtin.base-trace-and-facts",
    "sha256": "35b35da99c687b45ec509f6069dc34c5a82e64946da46b81ca35d5ce979d0677"
  },
  "semantic_payload": {
    "expected": {
      "lookup_words": [
        [
          1444891767,
          1444891767,
          1444891767,
          1444891767,
          1444891767,
          1444891767,
          1444891767,
          1444891767,
          1444891767,
          1444891767,
          1444891767,
          1444891767,
          1444891767,
          1444891767,
          1444891767,
          1444891767,
          1444891767,
          1444891767,
          1444891767,
          1444891767,
          1444891767,
          1444891767,
          1444891767,
          1444891767,
          1444891767,
          1444891767,
          1444891767,
          1444891767,
          1444891767,
          1444891767,
          1444891767,
          1444891767
        ],
        [
          14,
          46,
          78,
          110,
          142,
          174,
          206,
          238,
          270,
          205,
          237,
          269,
          301,
          333,
          62,
          94,
          126,
          158,
          93,
          125,
          157,
          189,
          221,
          253,
          285,
          317,
          253,
          284,
          316,
          45,
          1021,
          1
        ],
        [
          917615,
          3014799,
          5111983,
          7209167,
          9306351,
          11403535,
          13500719,
          15597903,
          17695087,
          13435182,
          15532366,
          17629550,
          19726734,
          21823918,
          4063391,
          6160575,
          8257759,
          10354943,
          6095038,
          8192222,
          10289406,
          12386590,
          14483774,
          16580958,
          18678142,
          20775326,
          16580958,
          18612605,
          20709789,
          2949262,
          66913374,
          65634
        ],
        [
          1444891767,
          1444891767,
          1444891767,
          1444891767,
          1444891767,
          1444891767,
          1444891767,
          1444891767,
          1444891767,
          1444891767,
          1444891767,
          1444891767,
          1444891767,
          1444891767,
          1444891767,
          1444891767,
          1444891767,
          1444891767,
          1444891767,
          1444891767,
          1444891767,
          1444891767,
          1444891767,
          1444891767,
          1444891767,
          1444891767,
          1444891767,
          1444891767,
          1444891767,
          1444891767,
          1444891767,
          1444891767
        ],
        [
          15,
          47,
          79,
          111,
          143,
          175,
          207,
          239,
          271,
          206,
          238,
          270,
          302,
          334,
          63,
          95,
          127,
          159,
          94,
          126,
          158,
          190,
          222,
          254,
          286,
          318,
          254,
          285,
          317,
          46,
          1022,
          2
        ],
        [
          983152,
          3080336,
          5177520,
          7274704,
          9371888,
          11469072,
          13566256,
          15663440,
          17760624,
          13500719,
          15597903,
          17695087,
          19792271,
          21889455,
          4128928,
          6226112,
          8323296,
          10420480,
          6160575,
          8257759,
          10354943,
          12452127,
          14549311,
          16646495,
          18743679,
          20840863,
          16646495,
          18678142,
          20775326,
          3014799,
          66978911,
          131171
        ],
        [
          1444891767,
          1444891767,
          1444891767,
          1444891767,
          1444891767,
          1444891767,
          1444891767,
          1444891767,
          1444891767,
          1444891767,
          1444891767,
          1444891767,
          1444891767,
          1444891767,
          1444891767,
          1444891767,
          1444891767,
          1444891767,
          1444891767,
          1444891767,
          1444891767,
          1444891767,
          1444891767,
          1444891767,
          1444891767,
          1444891767,
          1444891767,
          1444891767,
          1444891767,
          1444891767,
          1444891767,
          1444891767
        ],
        [
          16,
          48,
          80,
          112,
          144,
          176,
          208,
          240,
          272,
          207,
          239,
          271,
          303,
          335,
          64,
          96,
          128,
          160,
          95,
          127,
          159,
          191,
          223,
          255,
          287,
          319,
          255,
          286,
          318,
          47,
          1023,
          3
        ],
        [
          1048689,
          3145873,
          5243057,
          7340241,
          9437425,
          11534609,
          13631793,
          15728977,
          17826161,
          13566256,
          15663440,
          17760624,
          19857808,
          21954992,
          4194465,
          6291649,
          8388833,
          10486017,
          6226112,
          8323296,
          10420480,
          12517664,
          14614848,
          16712032,
          18809216,
          20906400,
          16712032,
          18743679,
          20840863,
          3080336,
          67044448,
          196708
        ],
        [
          520578465,
          520578465,
          520578465,
          520578465,
          520578465,
          520578465,
          520578465,
          520578465,
          520578465,
          520578465,
          520578465,
          520578465,
          520578465,
          520578465,
          520578465,
          520578465,
          520578465,
          520578465,
          520578465,
          520578465,
          520578465,
          520578465,
          520578465,
          520578465,
          520578465,
          520578465,
          520578465,
          520578465,
          520578465,
          520578465,
          520578465,
          520578465
        ],
        [
          917615,
          3014799,
          5111983,
          7209167,
          9306351,
          11403535,
          13500719,
          15597903,
          17695087,
          13435182,
          15532366,
          17629550,
          19726734,
          21823918,
          4063391,
          6160575,
          8257759,
          10354943,
          6095038,
          8192222,
          10289406,
          12386590,
          14483774,
          16580958,
          18678142,
          20775326,
          16580958,
          18612605,
          20709789,
          2949262,
          66913374,
          65634
        ],
        [
          983152,
          3080336,
          5177520,
          7274704,
          9371888,
          11469072,
          13566256,
          15663440,
          17760624,
          13500719,
          15597903,
          17695087,
          19792271,
          21889455,
          4128928,
          6226112,
          8323296,
          10420480,
          6160575,
          8257759,
          10354943,
          12452127,
          14549311,
          16646495,
          18743679,
          20840863,
          16646495,
          18678142,
          20775326,
          3014799,
          66978911,
          131171
        ],
        [
          1048689,
          3145873,
          5243057,
          7340241,
          9437425,
          11534609,
          13631793,
          15728977,
          17826161,
          13566256,
          15663440,
          17760624,
          19857808,
          21954992,
          4194465,
          6291649,
          8388833,
          10486017,
          6226112,
          8323296,
          10420480,
          12517664,
          14614848,
          16712032,
          18809216,